{"applicability":{"assemble_compact":{"boundary_near":{"n_a":"assemble_compact concatenates three segments; no near-boundary analogue exists"},"exact_bound":{"n_a":"the compact output is a JWS string, not a bounded artifact"},"invalid_algorithm":{"n_a":"the segments carry no algorithm field at assembly (header alg is opaque bytes here)"},"invalid_claim":{"n_a":"the segments carry no claim fields at assembly"},"invalid_duplicate":{"n_a":"the three segments have no member structure to duplicate"},"invalid_encoding":1,"invalid_key":{"n_a":"the signature segment is opaque bytes at assembly (key binding is a verify concern)"},"invalid_limit":{"n_a":"the input carries no bounds-tightening limit"},"invalid_nonce":{"n_a":"the segments carry no nonce field at assembly"},"invalid_request":{"n_a":"the assembly is not a request"},"invalid_selector":{"n_a":"the segments carry no selector"},"invalid_time":{"n_a":"the segments carry no temporal field at assembly"},"invalid_uri":{"n_a":"the segments carry no URI field at assembly"},"maximum_plus_one":{"n_a":"the compact output width is bounded by compact_bytes (pinned via bounds.new), not a fixed assembly ceiling"},"tamper_meaningful_byte":{"n_a":"this is a producer surface: it deterministically encodes/derives an output from a validated structured input and verifies no signature; a meaningful-byte tamper has nothing to reject against (a malformed field is rejected as invalid_encoding/invalid_claim, a well-formed field yields a deterministic output), so no verbatim-artifact tamper case exists"},"valid":1},"base64url.decode":{"boundary_near":{"n_a":"base64url.decode is an exact-bound decoder; no near-boundary analogue exists"},"exact_bound":{"n_a":"base64url.decode has no fixed input-width ceiling to pin exactly (segment length is unbounded below the json_bytes ceiling)"},"invalid_algorithm":{"n_a":"a base64url segment carries no algorithm field"},"invalid_claim":{"n_a":"a base64url segment carries no claim fields"},"invalid_duplicate":{"n_a":"a base64url segment has no member structure to duplicate"},"invalid_encoding":2,"invalid_key":{"n_a":"a base64url segment carries no key material"},"invalid_limit":{"n_a":"a base64url segment carries no bounds-tightening limit"},"invalid_nonce":{"n_a":"a base64url segment carries no nonce field"},"invalid_request":{"n_a":"a base64url segment is not a request"},"invalid_selector":{"n_a":"a base64url segment carries no selector"},"invalid_time":{"n_a":"a base64url segment carries no temporal field"},"invalid_uri":{"n_a":"a base64url segment carries no URI field"},"maximum_plus_one":{"n_a":"no fixed input-width ceiling exists to exceed (segment length is unbounded below json_bytes)"},"tamper_meaningful_byte":{"n_a":"the canonical base64url alphabet is closed under a single-byte xor-1 flip (an in-alphabet char maps to another in-alphabet char), so no single meaningful-byte flip changes the decode verdict"},"valid":1},"boundary_anchor_signing_input":{"boundary_near":{"n_a":"the anchor signing input is a fixed-structure JWS message; no near-boundary analogue exists"},"exact_bound":{"n_a":"the signing-input output is a JWS string, not a bounded artifact"},"invalid_algorithm":{"n_a":"the header alg is fixed (EdDSA); not parameterized"},"invalid_claim":{"n_a":"the anchor carries no claim fields"},"invalid_duplicate":{"n_a":"the anchor struct has no duplicate-member path"},"invalid_encoding":{"n_a":"the input is a structured anchor, not a byte encoding"},"invalid_key":2,"invalid_limit":{"n_a":"the input anchor carries no bounds-tightening limit"},"invalid_nonce":{"n_a":"an anchor carries no nonce"},"invalid_request":{"n_a":"the anchor is not a request"},"invalid_selector":{"n_a":"the anchor carries no selector"},"invalid_time":{"n_a":"temporal rejection is a verify_historical_anchor concern, not a signing-input concern"},"invalid_uri":{"n_a":"the anchor carries no URI field"},"maximum_plus_one":{"n_a":"the output width is bounded by anchor_bytes (pinned via bounds.new), not a fixed signing-input ceiling"},"tamper_meaningful_byte":{"n_a":"this is a producer surface: it deterministically encodes/derives an output from a validated structured input and verifies no signature; a meaningful-byte tamper has nothing to reject against (a malformed field is rejected as invalid_encoding/invalid_claim, a well-formed field yields a deterministic output), so no verbatim-artifact tamper case exists"},"valid":1},"bounds.new":{"boundary_near":{"n_a":"bounds.new validates tightening overrides against exact integer maxima; no near-boundary analogue exists (a value is either at most the maximum or above it)"},"exact_bound":38,"invalid_algorithm":{"n_a":"the overrides map carries no algorithm field"},"invalid_claim":{"n_a":"the overrides map carries no claim fields"},"invalid_duplicate":{"n_a":"the overrides map has no member structure whose duplication changes the verdict (rejected by the closed-key check as unknown key)"},"invalid_encoding":{"n_a":"the overrides map is structured JSON, not a byte encoding"},"invalid_key":{"n_a":"the overrides map carries no key material"},"invalid_limit":6,"invalid_nonce":{"n_a":"the overrides map carries no nonce field"},"invalid_request":{"n_a":"the overrides map is not a request"},"invalid_selector":{"n_a":"the overrides map carries no selector"},"invalid_time":{"n_a":"the overrides map carries no temporal field"},"invalid_uri":{"n_a":"the overrides map carries no URI field"},"maximum_plus_one":33,"tamper_meaningful_byte":{"n_a":"the dispatch input is a structured overrides map, not a byte string; the tamper loader reads input.text/base64url which this surface does not expose"},"valid":2},"check_chain":{"boundary_near":{"n_a":"check_chain returns row-range/head facts; no near-boundary analogue exists"},"exact_bound":{"n_a":"the chain facts are a value, not a bounded artifact"},"invalid_algorithm":{"n_a":"the chain carries no algorithm field"},"invalid_claim":5,"invalid_duplicate":{"n_a":"a chain row duplicate-member is rejected at parse as invalid_encoding"},"invalid_encoding":3,"invalid_key":{"n_a":"the chain carries no key material (anchored separately)"},"invalid_limit":{"n_a":"the chain carries no bounds-tightening limit"},"invalid_nonce":{"n_a":"the chain carries no nonce field"},"invalid_request":{"n_a":"the chain is not a request"},"invalid_selector":{"n_a":"the chain carries no selector"},"invalid_time":{"n_a":"the chain carries no temporal field"},"invalid_uri":{"n_a":"the chain carries no URI field"},"maximum_plus_one":{"n_a":"the chain input width is bounded by chain_rows \u00d7 chain_row_bytes (pinned via bounds.new), not a fixed check_chain ceiling"},"tamper_meaningful_byte":1,"valid":1},"check_envelope":{"boundary_near":{"n_a":"check_envelope returns envelope facts; no near-boundary analogue exists"},"exact_bound":{"n_a":"the envelope facts are a value, not a bounded artifact"},"invalid_algorithm":2,"invalid_claim":4,"invalid_duplicate":{"n_a":"a compact JWS duplicate-member input is rejected at parse as invalid_encoding"},"invalid_encoding":6,"invalid_key":1,"invalid_limit":{"n_a":"the envelope carries no bounds-tightening limit"},"invalid_nonce":1,"invalid_request":3,"invalid_selector":3,"invalid_time":1,"invalid_uri":{"n_a":"a target-URI mismatch is a request-binding failure (invalid_request, populated); the proof htu is signed, so no unsigned mutation isolates a URI-normalization defect \u2014 normalized-URI validity is exercised by the uri.normalize surface"},"maximum_plus_one":{"n_a":"the compact input widths are bounded by compact_bytes (pinned via bounds.new), not a fixed envelope ceiling"},"tamper_meaningful_byte":1,"valid":4},"decode_grant":{"boundary_near":{"n_a":"decode_grant returns the grant header/payload projection; no near-boundary analogue exists"},"exact_bound":1,"invalid_algorithm":1,"invalid_claim":{"n_a":"claim rejection is a verify_grant concern, not a decode concern"},"invalid_duplicate":{"n_a":"a compact JWS duplicate-member input is rejected at parse as invalid_encoding"},"invalid_encoding":7,"invalid_key":{"n_a":"the decoded grant carries no key material (cnf.jkt names a key, is not one)"},"invalid_limit":{"n_a":"the decoded grant carries no bounds-tightening limit"},"invalid_nonce":{"n_a":"a grant carries no nonce"},"invalid_request":{"n_a":"the grant is not a request"},"invalid_selector":{"n_a":"selector validity is a check_envelope concern, not a decode concern"},"invalid_time":{"n_a":"temporal rejection is a verify_grant concern, not a decode concern"},"invalid_uri":{"n_a":"a grant carries no URI field (issuer/audience are https but validity is checked at verify)"},"maximum_plus_one":1,"tamper_meaningful_byte":{"n_a":"decode_grant performs no signature or integrity verification (the result carries verification: not_evaluated); a signature-byte tamper decodes successfully (valid), so no meaningful-byte tamper is rejected here \u2014 only structural corruption, which is invalid_encoding"},"valid":1},"decode_proof":{"boundary_near":{"n_a":"decode_proof returns the proof header/payload projection; no near-boundary analogue exists"},"exact_bound":1,"invalid_algorithm":1,"invalid_claim":{"n_a":"claim rejection is a check_envelope concern, not a decode concern"},"invalid_duplicate":{"n_a":"a compact JWS duplicate-member input is rejected at parse as invalid_encoding"},"invalid_encoding":6,"invalid_key":{"n_a":"the decoded proof carries the holder_public_key but key validity is a verify concern (decode does not verify the signature)"},"invalid_limit":{"n_a":"the decoded proof carries no bounds-tightening limit"},"invalid_nonce":{"n_a":"a proof nonce is optional; its presence does not change the decode verdict"},"invalid_request":{"n_a":"the proof is not a request"},"invalid_selector":{"n_a":"selector validity is a check_envelope concern, not a decode concern"},"invalid_time":{"n_a":"temporal rejection is a check_envelope concern, not a decode concern"},"invalid_uri":{"n_a":"URI validity (htu n